id,album_title,eng_album_title,album_rd,album_seq,track_title,kor_track_title,eng_track_title,lyrics,hidden_track,remix,featured,performed_by,repackaged,lang,has_full_ver
163,LOVE YOURSELF 結 ‘Answer’,Love Yourself: Answer,2018-08-24,12,Tear ,,Tear,"goodbyes are, for me, a tear
without even knowing, it blooms around my eyes
the words that i could not bring myself to say flow down
and lingering regret crawls over my face
to me, you were once my dear
but now you're merely a bitter beer
my heart that's stained with belated self-loathing
becomes empty even with the passing breeze
at the end of my play where breakup was a lie
the price that i had to pay came to me
if someone said they would turn back the time for me
would i have been able to be a bit more honest?
the bare face that only i know
the ugly and pathetic old friends within me
would you still be able to love me again like before
with that smile with which you used look at me
stop saying things like forever, forever
after all, the end originally exists
if there's a start, i don't wanna listen to that
words that are too correct or too much consolation.. i don't wanna listen to that
i was just so scared
because it seemed like perhaps i had never loved you at all
although it was late, that you were true
that only you loved me
more

you're my tear
you're my, you’re my tear
you're my tear
you're my, you're my tear
you're my tear
you're my, you're my tear
what more can i say?
you're my tear

we walked towards the same place
but this place becomes our last
although we used to talk about forever
now we break each other without mercy
although we thought that we dreamed the same dream
that dream has finally become a dream
my heart is torn, please burn it instead
so that pain and regret, none of that would be left

you're my tear
you're my, you're my tear
you're my tear
you're my, you're my tear
you're my fear
you're my, you're my fear
what more can i say?
you're my...

goodbyes are t.e.a.r
because things like tears are a luxury
there's no such thing as beautiful goodbyes
so just begin now
woo take it easy, slowly carve out my heart
that's right, that’s right, gently step on the shards that have shattered
so that regret, regret, such a thing will no longer be left
please burn up my heart that was torn into shreds
that's right, right there, what are you hesitating for
this is the ending you were wishing for
so go on and kill me without hesitating
woo yeah yeah burn it
woo yeah yeah yeah burn it
woo yeah yeah yeah burn it
so not even the ashes remain

this is the real you and this is the real me
now we've seen the end and not even resentment is left
i've woken up from the sweet dream and i close my eyes
this is the real you and this is the real me

we walked towards the same place
but this place becomes our last
although we used to talk about forever
now we break each other without mercy
although we thought that we dreamed the same dream
that dream has finally become a dream
my heart is torn, please burn it instead
so that pain and regret, none of that would be left

you're my tear
you're my, you're my tear
you're my tear
you're my, you're my tear
you're my fear
you're my, you're my fear
what more can i say?
you're my...

what should i say?
we know
the answer is fixed
but replying is always hard

why are you spilling it?
why are you tearing it up?
it's useless, to me
goodbye to me is only those moments (flashback)
the moment you say words from your mouth
the moment our focus becomes irregular
at the moment where everything is dangerous
our end that two letters handed to us
that i won't cry, that i won't tear it up
i can't say those kinds of words. in the future i, too
breakup, incurable disease
you're my beginning and my end, that is all
my meeting and my farewell
you were everything, step forward fear
it will be repeated, caused by you
tear
tear",FALSE,FALSE,,BTS,TRUE,KOR,FALSE
164,LOVE YOURSELF 結 ‘Answer’,Love Yourself: Answer,2018-08-24,13,Epiphany,,Epiphany,"so weird, i for sure loved you so much
adapted to you with everything, i wanted to live my life for you
but as i keep doing that i just can't bear the storm inside my heart
the real myself inside the smiling mask, i reveal it entirely

i’m the one i should love in this world
shining me, precious soul of mine
i finally realized so i love me
not so perfect but so beautiful
i’m the one i should love

i’m shaking and afraid but i keep going forward
i’m meeting the real you, hidden in the storm
why did i want to hide my precious self like this?
what was i so afraid of?
why did i hide my true self?

i’m the one i should love in this world
shining me, precious soul of mine
i finally realized so i love me
not so perfect but so beautiful
i'm the one i should love""",FALSE,FALSE,,JIN,FALSE,KOR,FALSE
165,LOVE YOURSELF 結 ‘Answer’,Love Yourself: Answer,2018-08-24,14,I'm Fine ,,I'm Fine ,"open your eyes under the cold blue sky
the pouring sun makes me dizzy
my breath is quickening, my heart is racing
i can feel it so easily that i’m alive

it’s alright, even if it’s not us
even if sadness erases me
even if there are clouds
even if i’m in an endless dream
even if i’m endlessly crumpled
even if my wings are torn
even if some day, i’m not me anymore
it’s alright, only i am my own salvation
i won’t ever die in this walk
how you doin? im fine
my sky is clear
all pain, say goodbye
goodbye

my cold heart
has forgotten how to call you
but i’m not lonely, i’m fine, i’m fine
the darkness of the night
shakes awake my sleeping dreams
but i’m not afraid, i’m fine, i’m fine

i'm feeling just fine, fine, fine
i'll let go of your hand now
i know i'm all mine, mine, mine
cuz i'm just fine
i'm feeling just fine, fine, fine
i don't want to be sad anymore
i could see the sunshine, shine, shine
cuz i'm just fine, just fine

(hey, hope world)
i’m just fine, all of my pain
i can overcome without you
i’m just fine, don’t worry
i can smile now
because everyone knows your voice

i’m so fine, you so fine
all of the sadness and scars
became an old memory now
so let’s smile and let go, we so fine
i’m so fine, you so fine
our future will only have happiness
so put away your fear
enjoy it, you worked hard, we so fine

my cold heart
has forgotten how to call you
but i’m not lonely, i’m fine, i’m fine
the darkness of the night
shakes awake my sleeping dreams
but i’m not afraid, i’m fine, i’m fine

i'm feeling just fine, fine, fine
i'll let go of your hand now
i know i'm all mine, mine, mine
cuz i'm just fine
i'm feeling just fine, fine, fine
i don't want to be sad anymore
i could see the sunshine, shine, shine
cuz i'm just fine, just fine

can you see it too?
the dim moonlight?
can you hear it too?
that faint echo?

i'm feeling just fine, fine, fine
i'll yell it out myself
casting a spell
on this repeating nightmare
i’m feeling just fine, fine, fine
i’ll keep telling myself
even if i fall down again
i’m fine

i'm feeling just fine, fine, fine
i'll yell it out myself
casting a spell
on this repeating nightmare
i’m feeling just fine, fine, fine
i’ll keep telling myself
even if i fall down again
i'm fine
i'm fine",FALSE,FALSE,,BTS,FALSE,KOR,FALSE
166,LOVE YOURSELF 結 ‘Answer’,Love Yourself: Answer,2018-08-24,15,IDOL ,,IDOL,"you can call me artist (artist)
you can call me idol (idol)
no matter what you call me
i don’t care
i’m proud of it (proud it)
i’m free (free)
no more irony (irony)
cuz i was always just me

they point fingers at me
but i don’t care at all
whatever the reason for your criticism is
i know what i am (i know what i am)
i know what i want (i know what i want)
i never gon’ change (i never gon' change)
i never gon’ trade
(trade off)

keep on chit-chatting, saying this and that
i do what i do, so you do you
you can’t stop me lovin’ myself

eolssu, i like it
you can’t stop me lovin’ myself
i like the shouts
you can’t stop me lovin’ myself

oh-oh-owoah
oh-oh-owoah-owoah
oh-oh-owoah
dunkiduk kungduruhruh
ulssu
oh-oh-owoah
oh-oh-owoah-owoah
oh-oh-owoah
dunkiduk kungduruhruh
ulsoo

face off, just like john woo, ay
top star with that spotlight, ay
sometimes like a superhero
i'm your anpanman
24 hours isn’t enough
can’t afford to be confused
i do my thang (i do my thang)
i love myself (i love myself)

i love myself, i love my fans
love my dance and my what
there are hundreds of me’s inside of me
i’m facing a new me again today
it’s all me anyway
so instead of worrying, i’m just gonna run
runnin’ man
runnin’ man
runnin’ man

keep on chit-chatting, saying this and that
i do what i do, so you do you
you can’t stop me lovin’ myself

eolssu, i like it
you can’t stop me lovin’ myself
i like the shouts
you can’t stop me lovin’ myself

oh-oh-owoah
oh-oh-owoah-owoah
oh-oh-owoah
deonggideok kungdeoreoreo
eolssu
oh-oh-owoah
oh-oh-owoah-owoah
oh-oh-owoah
deonggideok kungdeoreoreo
eolssu

i’m so fine wherever i go
even if it takes a while sometimes
it’s okay, i’m in love with my-my myself
it’s okay, i’m happy in this moment

ulssu, i like it
you can’t stop me lovin’ myself
i like the shouts
you can’t stop me lovin’ myself

oh-oh-owoah
oh-oh-owoah-owoah
oh-oh-owoah
dunkiduk kungduruhruh
ulssu
oh-oh-owoah
oh-oh-owoah-owoah
oh-oh-owoah
dunkiduk kungduruhruh
ulssu",FALSE,FALSE,,BTS,FALSE,KOR,FALSE
167,LOVE YOURSELF 結 ‘Answer’,Love Yourself: Answer,2018-08-24,16,Answer: Love Myself ,,Answer: Love Myself ,"i’m opening my eyes in the darkness
when my heartbeat sounds unfamiliar
i’m looking at you in the mirror
the fear-ridden eyes, asking the question

loving myself might be harder
than loving someone else
let’s admit it
the standards i made are more strict for myself
the thick tree rings in your life
it’s part of you, it’s you
now let’s forgive ourselves
our lives are long, trust yourself when in a maze
when winter passes, spring always comes

from the eyes of the cold night
i try to hide myself
as i keep tossing and turning ey
maybe i fell in order to take the place of those countless stars
the target of  thousands of bright arrows is me alone

you’ve shown me i have reasons
i should love myself (oh)
i’ll answer with my breath, my path

the me of yesterday, the me of today, the me of tomorrow
(i’m learning how to love myself)
with no exceptions, it’s all me

maybe there’s no answer
maybe this isn’t the answer either
it’s just that loving myself
doesn’t require anyone else’s permission
i’m looking for myself again
but i don’t wanna die anymore
me, who used to be sad
me, who used to be hurt
it’ll make me more beautiful

yes, i have that beauty
knowing that is going
on the path to loving myself
it’s what i need the most
i’m walking for myself
it’s an action needed for me
my attitude towards myself
that’s the happiness i need for me
i’ll show you what i got
i’m not afraid because it’s me
love myself

from the very beginning
to the very end
there’s only one answer ey
why do you keep trying to hide under your mask? (hey)
even all the scars from your mistakes make up your constellation (ey)

you’ve shown me i have reasons
i should love myself (oh)
i’ll answer with my breath, my path

inside of me
there’s still
that awkward part of me but (woah)

you’ve shown me i have reasons
i should love myself
(i’m learning how to love myself oh)
i’ll answer with my breath, my path

the me of yesterday, the me of today, the me of tomorrow (woah)
(i’m learning how to love myself)
with no exceptions, it’s all me",FALSE,FALSE,,BTS,FALSE,KOR,FALSE
168,LOVE YOURSELF 結 ‘Answer’,Love Yourself: Answer,2018-08-24,17,Magic Shop ,,Magic Shop ,"i know that you’re hesitating because even if you say the truth
in the end it will all return as scars
i’m not going to say anything blatant like “find strength”
i will let you hear my story, let you hear it

what did i say?
i said you’d win, didn’t i?
i couldn’t believe it (really)
could i win it?
this miracle that isn’t a miracle
did we make it?
(no) i was here
you were the one that made your way to me
i do believe your galaxy
i want to listen to your melody
your stars in the milky way
don’t forget that i found you anyways
at the end of my despair
you’re the last reason
for me who was standing at the edge of the cliff
live

on days i hate being myself, days i want to disappear forever
let's make a door in your heart
open the door and this place will await
it's okay to believe, the magic shop will comfort you

while drinking a glass of hot tea
and looking up at the milky way
you’ll be alright, oh, this here is the magic shop

so show me (i'll show you)
so show me (i'll show you)
so show me (i'll show you)
show you show you

like a rose when blooming
like cherry blossoms when being scattered in the wind
like morning glory when fading
like that beautiful moment
i always want to be the best
so i was impatient and always restless
comparing myself with others became my daily life
my greed that was my weapon suffocated me and also became a leash
but looking back on it now, truthfully
i feel like it’s not true that i wanted to be the best
i wanted to become your comfort and move your heart
i want to take away your sadness, and pain

on days where i hate myself for being me, on days where i want to disappear forever
let's make a door. it's in your heart
open the door and this place will await
magic shop

while drinking a glass of hot tea
and looking up at the milky way
you’ll be alright, oh, this here is the magic shop

so show me (i'll show you)
so show me (i'll show you)
so show me (i'll show you)
show you show you

would you believe me if i said that i was scared of everything too?
all the sincerity, the remaining times
all your answers are in this place you found
in your milky way, inside your heart

you gave me the best of me
so you'll give you the best of you
you found me. you knew me
you gave me the best of me
so you'll give you the best of you
you'll find it, the galaxy inside you

so show me (i'll show you)
so show me (i'll show you)
so show me (i'll show you)
show you show you",FALSE,FALSE,,BTS,TRUE,KOR,FALSE
169,LOVE YOURSELF 結 ‘Answer’,Love Yourself: Answer,2018-08-24,18,Best of Me ,,Best of Me ,"when you say that you love me
i walk above the clouds
tell me about eternity just one more time
when you say that you love me
all i need is that one phrase
that you’ll never change, just one more time

you're like the whole world to me
hug me harder and more painfully
that something that we shared
and you can’t make it nothing
i hope you don’t forget
that you’re my

day by day
summer, winter
even if you don’t know

you got the best of me
you got the best of me
so please just don’t leave me
you got the best of me

even though i haven't seen my limits
but if it exists, it's probably you
i wanted to be the tender waves
but why didn’t i know you were the sea?
what do i do?
i speak with your language
and i breathe in your air
i’ll be you, i'll be in your grasp
as i kiss your sword

so take my hand right now
i don't believe that i'm like this
the words i've said to myself a million times
please, don’t leave me
you got the best of me
you got the best of me
it's not important if it's a dream or reality
only the fact that you're by my side
thanks

day by day
summer, winter
even if you may be unaware

you got the best of me
you got the best of me
so please just don’t leave me
you got the best of me

you’re my savior, you’re my window
all i need is you
you got the best of me
i need you
so please just don’t leave me
you got the best of me

i used to rain
i used to snow
i stop all the misfortune
and i bring the heavens
don't speak of it so lightly
there's no me without you
you’re the best of me
the best of me

you just give me the confidence within myself
that's all i wanted
there may not be rules between us
but the way to love exists
who got the best of me?
who got the best of me?
no one knows but i know me
you are my best master

you got the best of me
you got the best of me
so please just don’t leave me
you got the best of me

you’re my savior, you’re my window
all i need is you
you got the best of me
i need you
so please just don’t leave me
you got the best of me

when you say that you love me
i walk above the clouds
tell me of eternity, just one more time
when you say that you love me
all i need is that one phrase
that you’ll never change, just one more time",FALSE,FALSE,,BTS,TRUE,KOR,FALSE
170,LOVE YOURSELF 結 ‘Answer’,Love Yourself: Answer,2018-08-24,19,Airplane pt.2 ,,Airplane pt.2 ,"an odd kid
he sang as if he was breathing
wherever was fine
he only wanted to do music
only singing
the thing that made his heart beat
although he walked down the only path

it’s not easy
failure and frustration
words that someone gave me after calling me, exhausted, to stop
you’re a singing star
you’re a singing star
but i see no star...
after some years passed by

(we still) sky high, sky fly, sky dope
(we still) same try, same scar, same work
(we still) wherever in the world we go
(we still) we work in our hotel rooms
(i still) one day it works out too well, then the next day i’m completely screwed
(i still) who should i live as today, kim namjoon or rm?
25, i still don’t know how to live well
so, today as well, we just go

we goin’ from ny to cali
london to paris
wherever we go, party
el mariachi
el mariachi
el mariachi
we goin’ from tokyo, italy
hong kong to brazil
wherever in the world, i will sing
el mariachi
el mariachi
el mariachi
el mariachi

every day above the clouds, every day above the clouds
my feel above the clouds, check it above the clouds
my chemistry with the clouds, all day with the clouds
the fun of riding the clouds, fade in looking at the clouds
you don’t know maybe
thanks to years of flying
i got a few hundred thousand mileage
it’s time to console you who couldn’t make it
i’ll give you the flight points as a present
love the airplane mode, turn off all the concerns
no matter what anyone says
i’ll just continue to keep the first
and look at the night sky as it fits my place right now

i don’t know, i don’t know, i don’t know, i don’t know
yeah how to stop
i don’t know, i don’t know, i don’t know, i don’t know
yeah how to take some rest
i don’t know, i don’t know, i don’t know, i don’t know
yeah how to fail
i don’t know, i don’t know, i don’t know, i don’t know
i got fed up by you cutely bragging about your money on tv
my passport is about to die from overworking
you’re the ones who benefitted from media, hahahaha
hey, hey you’re the ones who’re better at playing celebrities
we’re still the same as back then
woo!

we goin’ from mexico city
london to paris
wherever we go, party
el mariachi
el mariachi
el mariachi
we goin’ from tokyo, italy
hong kong to brazil
wherever in the world, i will sing
el mariachi
el mariachi
el mariachi
el mariachi
(el mari- ah-whoo~ whoo~ whoo~ whoooo~)",FALSE,FALSE,,BTS,TRUE,KOR,FALSE
171,LOVE YOURSELF 結 ‘Answer’,Love Yourself: Answer,2018-08-24,20,고민보다 Go (Go Go) ,고민보다 Go,Go Go,"dollar dollar
squandering it all in one day
run, run, i make and waste my own money
run, run, run, run
run, run

i want to be cruisin’ on the bay
i want to be cruisin’ like nemo
no money but i wanna go far away
i don’t have money but i wanna relax
no money but i wanna eat jiro ono’s sushi

worked hard to get my pay
gonna spend it all on my stomach
pinching pennies to spend it all on wasting it
leave me be, even if i overspend
even if i break apart my savings tomorrow
like a crazy guy

woo there’s no tomorrow
there’s already a mortgage on my future
woo spending my money even more
friends, wussup
do you want some?

dollar dollar
squandering it all in one day
run, run, man i spend it like some party
dollar dollar
till the sun shines through this mouse hole
till the sun comes up

yolo yolo yolo yo
yolo yolo yo
squandering fun, squandering fun, squandering fun
yolo yolo yolo yo
where my money yah
squandering fun, squandering fun, squandering fun
yolo yolo yolo yo
yolo yolo yo
squandering fun, squandering fun, squandering fun
yolo yolo yolo yo
where the party yah
squandering fun, squandering fun, squandering fun

where my money yah?
where the party yah?
my week goes monday, tuesday, wednesday, thursday, gold gold gold gold
my bank account is a pot with no bottom
every day, i’m pouring water into it
just break it apart
we’re too young to just worry
for today, just go instead of worrying
if you get scared and say you’re saving, it becomes poop
so rub it all around

dollar dollar
squandering it all in one day
run, run, man i spend it like some party
dollar dollar
till the sun shines through this mouse hole
till the sun comes up

yolo yolo yolo yo
yolo yolo yo
squandering fun, squandering fun, squandering fun
yolo yolo yolo yo
where my money yah
squandering fun, squandering fun, squandering fun
yolo yolo yolo yo
yolo yolo yo
squandering fun, squandering fun, squandering fun
yolo yolo yolo yo
where the party yah
squandering fun, squandering fun, squandering fun

just go instead of worrying
just go instead of worrying
just go instead of worrying (everybody!)
just go instead of worrying
just go instead of worrying
just go instead of worrying (everybody!)

just go instead of worrying
just go instead of worrying
just go instead of worrying (everybody!)
just go instead of worrying
just go instead of worrying
just go instead of worrying (everybody!)

just go instead of worrying
just go instead of worrying
just go instead of worrying (everybody!)
just go instead of worrying
just go instead of worrying
just go instead of worrying (everybody!)",FALSE,FALSE,,BTS,TRUE,KOR,FALSE
172,LOVE YOURSELF 結 ‘Answer’,Love Yourself: Answer,2018-08-24,21,Anpanman ,,Anpanman ,"waiting for you, anpanman
waiting for you, anpanman

i don’t have biceps or pecs
i don’t have a super car like batman
the ideal hero is my fantasy
but all i can give you is anpan
i’ve dreamed of becoming a hero like superman
i ran with all my strength, jumping high up in the sky
i’m not afraid of little things like bruising my knees
a innocent fantasies of my childhood

i’m not a superhero
don’t expect a lot
i can be your hero
i’m really not sure whether that even makes sense
but mom, i really need to do it
who’s gonna do it if it isn’t me?
you can call me, say anpan

waiting for you, anpanman
(lemme hear ya say, lemme hear ya say)
waiting for you, anpanman
(turn it up, turn it up, turn it up)
i’ll muster up the strength a little more
(lemme hear ya say, lemme hear ya say)
i’ll be your strength
(turn it up, turn it up, turn it up)

keep spinning and spinning my anpan
keep ballin’, ballin’ still bangtan
as i open my eyes, i’m a hero, but still in maze
that young man, young man, young man
keep secretly, secretly getting covered in bruises
but ballin’, ballin’ still bangtan
even if i’m hurt, i’m a hero, put the fear behind
anpanman, panman, panman

i’m a new generation, anpanman
i’m a new superhero, anpanman
all i have is this one song
lemme say “all the bad men, cop out”
i’m a new generation, anpanman
i’m a new superhero, anpanman
all i have is this song
lemme say “all the bad men, cop out”

sometimes i’m afraid of all this
because i came to have so many things that i love
some say, you’re almost an old fossil now
you’re not qualified, just do what you’ve been doing before
but i still want to be a hero
all i can give you is anpan
and a word, ""you’ve worked hard,""
but i’ll fly to you right away if you call me
please call me

waiting for you, anpanman
(lemme hear ya say, lemme hear ya say)
waiting for you, anpanman
(turn it up, turn it up, turn it up)
i’ll muster up the strength a little more
(lemme hear ya say, lemme hear ya say)
i’ll be your strength
(turn it up, turn it up, turn it up)

keep spinning and spinning my anpan
keep ballin’, ballin’ still bangtan
as i open my eyes, i’m a hero, but still in maze
that young man, young man, young man
keep secretly, secretly getting covered in bruises
but ballin’, ballin’ still bangtan
even if i’m hurt, i’m a hero, put the fear behind
anpanman, panman, panman

to be honest
i’m scared of falling
and of letting you down
but, even if it takes up all my strength
i will be sure that i stay by your side
although i’ll fall again
i’ll make a mistake again
and i’ll be covered in mud
i believe in myself because i’m a hero
yeah, yeah

keep spinning and spinning my anpan
keep ballin’, ballin’ still bangtan
as i open my eyes, i’m a hero, but still in maze
that young man, young man, young man
keep secretly, secretly getting covered in bruises
but ballin’, ballin’ still bangtan
even if i’m hurt, i’m a hero, put the fear behind
anpanman, panman, panman

i’m a new generation, anpanman
i’m a new superhero, anpanman
what i have is a single blow of this song
lemme say “all the bad men, cop out”
i’m a new generation, anpanman
i’m a new superhero, anpanman
what i have is a single blow of this song
lemme say “all the bad men, cop out”",FALSE,FALSE,,BTS,TRUE,KOR,FALSE
