id,album_title,eng_album_title,album_rd,album_seq,track_title,kor_track_title,eng_track_title,lyrics,hidden_track,remix,featured,performed_by,repackaged,lang,has_full_ver
52,Dark and Wild,Dark and Wild,2014-08-19,12,Look Here ,여기 봐,Look Here ,"at first, i was only curious as i started to show interest in you
holy shhh yeah, even if you ignore me
you’ll fall for me for a minute
we look good together, without you, i’m like a seoul city without lights
i fiercely glare at your empty spot, a rabbit hole graffiti
a day without you is a one-act play of tragedy
us meeting isn’t just coincidence
meeting you was what i wanted
you’re a flower and i’m a bee
you’re honey and i’m a bear
words come out as if reading a book
seems like you resemble me somehow
you’re so pretty, i’m getting a feeling
your charms are exploding, come give it to me
look here, don’t run away
look here, don’t run away
look here, don’t run away
because soon, you’ll want me
when you’re crying because you’re lonely, it’s already too late
i already figured out your pretty charms
baby come on
at first, you answered once when i texted ten times
but later, you call me first and look for me all day
look here, don’t run away
look here, don’t run away
look here, don’t run away
look here
a guy like me has talent for going to you
admit it, i ran my finances for you
achoo, words like a sneeze, bless you
if you get bored, i’ll debut every week
i’ll go to you, what do you want?
come with me to the sea of love
you’re a thief, i’m the police, pay for your crime
without you, i’m a lonely city nomad
i want you
us meeting isn’t just coincidence
meeting you was what i wanted
you’re a flower and i’m a bee
you’re honey and i’m a bear
words come out as if reading a book
seems like you resemble me somehow
you’re so pretty, i’m getting a feeling
your charms are exploding, come give it to me
look here, don’t run away
look here, don’t run away
look here, don’t run away
because soon, you’ll want me
when you’re crying because you’re lonely, it’s already too late
i already figured out your pretty charms
baby come on
at first, you answered once when i texted ten times
but later, you call me first and look for me all day
love your alexander wang, love your isabel marant
baby stop playing hard to get, cmon show me what you got
you sexy girl, that’s important to me
(you’re my ideal type) let’s get married
you’re featuring in my daily life
weighing 99kg
i can’t shake you off, i hate you
i’m wishing for some luck today
you’re cute and pretty, the truth and reason
yo my genie, lamborghini, be my teenie weenie mini
you’re a bikini and martini, mercedes so hot
it’s too tiring so stop that eenie menie miny
please take me out of here
let me switch your mind, please change
stand over there, let me walk with ya
sweet talk to me
get it?
look here, don’t run away
look here, don’t run away
look here, don’t run away
because soon, you’ll want me
when you’re crying because you’re lonely, it’s already too late
i already figured out your pretty charms
baby come on
at first, you answered once when i texted ten times
but later, you call me first and look for me all day
look here, don’t run away
look here, don’t run away
look here, don’t run away
look here",FALSE,FALSE,,BTS,FALSE,KOR,FALSE
53,Dark and Wild,Dark and Wild,2014-08-19,13,Second Grade/So 4 More ,2학년,Second Grade/So 4 More ,"at the blink of an eye, i went to grade 2
pulling on my chains again cause time flowing fast
(still everyday) bang it bang it, bang it bang it
(still everyday) bang it bang it, bang it bang it
at the blink of an eye, i went to grade 2
i only chased my dreams but now i’m setting the stage on fire
(still everyday) bang it bang it, bang it bang it
(still everyday) bang it bang it, bang it bang it
nothing’s really changed baby, it’s my second year of kpop
i’m still 181 baby, only my heart grew taller
i’m the first in my class baby, i even got the rookie award
going around the halls, i even get greeted by new juniors
i think i know what’s going on now, rehearsals going smoothly
i have juniors a year below me and i think i’m doing well now
ahh, shit but i see seniors five and six years above
(hello!) now i realize, i’m still far away
teachers didn’t give pressure last year
saying that i’m just a rookie and that it’s okay
they sat me down and taught me how cold the world is
with a few subjects
bias, negative comments, double standards, smack talk and disinterest
teacher, do we have tests for this too?
if i get first place, will i be a successful artist?
that’s good too but i wanna do music
i’ll just do what i want for now so leave me alone
work it out work it out 24 hours
burn it up burn it up, burn up every moment
put back your worries
even after a year, we live for today
at the blink of an eye, i went to grade 2
pulling on my chains again cause time flowing fast
(still everyday) bang it bang it, bang it bang it
(still everyday) bang it bang it, bang it bang it
at the blink of an eye, i went to grade 2
i only chased my dreams but now i’m setting the stage on fire
(still everyday) bang it bang it, bang it bang it
(still everyday) bang it bang it, bang it bang it
i’m already in my second year (oh no)
at the blink of an eye, time is so fast (go go)
work hard play hard right
a year passed like a miracle bye
but what to do? i’m getting worried
i might be a bit more comfortable but there’s still so much to learn
every time i get a break, the teacher keeps nagging
“you need to take the test!”
what do you mean test
teacher, we are human too
just nod along, nod
let’s push everything back today and go tease the juniors
i’ll go to the pc cafe today, i can’t sleep
work it out work it out 24 hours
burn it up burn it up, burn up every moment
put back your worries
even after a year, we live for today
at the blink of an eye, i went to grade 2
pulling on my chains again cause time flowing fast
(still everyday) bang it bang it, bang it bang it
(still everyday) bang it bang it, bang it bang it
at the blink of an eye, i went to grade 2
i only chased my dreams but now i’m setting the stage on fire
(still everyday) bang it bang it, bang it bang it
(still everyday) bang it bang it, bang it bang it
a second year rapper, put a score on him
fortunately, i put up a good defense
i’m still a child, i kept running but am only in my second year
like gulliver traveling between strangeness and reality
i don’t care about others, i’ll just go with the flow
bring all the losers with bias to me
looking back makes my blood dry up
shut up, i’m in my second year, the starting point of a new era
hide carefully or else you’ll see past my tricks
whether you’re a senior or junior or teacher, get the out
at the blink of an eye, i went to grade 2
pulling on my chains again cause time flowing fast
(still everyday) bang it bang it, bang it bang it
(still everyday) bang it bang it, bang it bang it
at the blink of an eye, i went to grade 2
i only chased my dreams but now i’m setting the stage on fire
(still everyday) bang it bang it, bang it bang it
(still everyday) bang it bang it, bang it bang it",FALSE,FALSE,,BTS,FALSE,KOR,FALSE
54,Dark and Wild,Dark and Wild,2014-08-19,14,Outro: Do You Think It Makes Sense? ,그게 말이 돼?,Outro: Do You Think It Makes Sense? ,"i rewind my girl baby come back to my world
i rewind my girl come back (come back, come back)
i rewind my girl baby come back to my world
i rewind my girl come back (listen)
do you think that makes sense?
our love changing that easily?
without anyone knowing, as if everything’s fine
i met you but just by seeing your face, i am crying
explain it, explain it, explain it girl
my baby explain it, explain it
i hate you so much but even now i’m thinking of you
love is not over, it doesn’t make sense
story is not over, it doesn’t make sense
talk is not over, it doesn’t make sense still
problem is not over, it doesn’t make sense
your look makes my breath explode
your finger that held me, that white finger
i thought it would last forever
but you changed as time passed
your words and face turned so cold
our relationship kept going around in place
i didn’t say anything but i knew
that there was no more room for me in your heart
do you think that makes sense?
our love changing that easily?
without anyone knowing, as if everything’s fine
i met you but just by seeing your face, i am crying
explain it, explain it, explain it girl
my baby explain it, explain it
i hate you so much but even now i’m thinking of you
i rewind my girl baby come back to my world
i rewind my girl come back
i rewind my girl baby come back to my world
i rewind my girl come back",FALSE,FALSE,,JUNGKOOK; V; JIMIN; JIN,FALSE,KOR,FALSE
55,화양연화 The Most Beautiful Moment In Life Pt.1,The Most Beautiful Moment In Life Pt.1,2015-04-24,1,Intro: 화양연화 (The Most Beautiful Moment In Life) ,Intro: 화양연화,Intro: The Most Beautiful Moment In Life,"the rim looks farther away today
sighs are building on top of the court
the boy is afraid of reality
but his heart is at peace only when he throws the ball
throwing the ball by himself
what i’m shooting at the rim
are my countless thoughts and worries
i pretend to know the world but my body is still not ready
shoot, the court is my playground
with my movements, a small ball bounces next to my feet
the results are as low as the floor
but i just shout out loud to the world that everything’s gonna be alright
but the world gives me fear, then just stop
thoughts fill my head and instead of the ball, i throw my future
because of the other’s standard of success
my worries spread like cancer again, god damn it
along with the thrown ball, laughter starts to spread
my breath rises to my chin, my dreams squirm about
the dribbles get faster, my heart gets happier
this moment feels like it’ll last forever but the sun is setting
when the night comes again, reality gets destroyed
when i snap out of it, i’m just a scared idiot again
i keep getting scared at the looming sense of reality
others are running ahead but why am i still here?
breathe or dream
row the oars along with your heartbeat
if you are trapped in the other’s thin judgements
then the sun will set on your life like a court
what am i doin’ with my life
this moment won’t ever come again
i’m asking myself again, am i happy right now?
the answer is already there, i’m happy",FALSE,FALSE,,SUGA,FALSE,KOR,FALSE
56,화양연화 The Most Beautiful Moment In Life Pt.1,The Most Beautiful Moment In Life Pt.1,2015-04-24,2,I NEED U ,,I NEED U ,"fall fall fall, scattering apart
fall fall fall, falling

because of you, i’m becoming ruined
i wanna stop, i don’t want you anymore
i can’t do it, this sucks
please don’t give me any excuses

you can’t do this to me
all of the things you said are like a mask
it hides the truth and rips me apart
it pierces me, i’m going crazy, i hate this
take it all away, i hate you

but you’re my everything (you’re my)
everything (you’re my)
everything (you’re my)
please go away huh
i’m sorry (i hate you)
i love you (i hate you)
forgive me

i need you girl
why am i in love alone, why am i hurting alone
i need you girl
why do i keep needing you when i know i’ll get hurt?
i need you girl, you’re beautiful
i need you girl, you’re so cold
i need you girl i need you girl
i need you girl i need you girl

it goes round & round, why do i keep coming back
i go down & down, at this point, i’m just a fool
whatever i do, i can’t help it
it’s definitely my heart, my feelings but why don’t they listen to me
i’m just talking to myself again, talking to myself again
i’m just talking to myself again, talking to myself again
you’re not saying anything, please, i’ll treat you well
but the sky is blue, the sky is blue

the sky is blue and the sun is shining
so my tears are even more noticeable
why is it you? why did it have to be you?
why can’t i leave you?

i need you girl
why am i in love alone, why am i hurting alone
i need you girl
why do i keep needing you when i know i’ll get hurt?
i need you girl, you’re beautiful
i need you girl, you’re so cold
i need you girl i need you girl
i need you girl i need you girl

girl, just tell me you wanna break up
girl, just tell me it wasn’t love
i have no courage to say that
give me my last gift
so i can’t ever go back to you

i need you girl
why am i in love alone, why am i hurting alone
i need you girl
why do i keep needing you when i know i’ll get hurt?
i need you girl, you’re beautiful
i need you girl, you’re so cold
i need you girl i need you girl
i need you girl i need you girl",FALSE,FALSE,,BTS,FALSE,KOR,FALSE
57,화양연화 The Most Beautiful Moment In Life Pt.1,The Most Beautiful Moment In Life Pt.1,2015-04-24,3,잡아줘 (Hold Me Tight),잡아줘,Hold Me Tight,"i empty my drink but it gets filled with loneliness
i should’ve just given in, why did i argue all the time?
even the trash bag thrown away on the street makes a lonely sound in the wind
all i did was color you in my white, blank paper
but then i realized, it already became a finished picture
you and i are like cell phones, when we’re apart you know we’ll be broken
only your scent completes me
hurry and hug me

i can only see you
i can only see you alone
look, i’m fair with everyone else but you
now i can’t live a day without you, please

hold me tight, hug me
can you trust me? can you trust me? can you trust me?
pull me in tight
hold me tight, hug me
can you trust me? can you trust me?
please, please, please pull me in and hug me

you still shine
you’re still like a scented flower
now trust me, hold me once again
so i can feel you, hold me
without you, i can’t breathe
i’m nothing without you
open my closed heart, drench my heart
so i can feel you, hold me

your arms, your warmth, your heart
i want to see it all, i beg you
this moment, even the warm flower scented wind
even the sky without a single cloud
everything feels cold and i’m even scared of the clear sky
if you’re not here, i’m just a corpse, so how can i breathe?
it hurts, i’m always cry cry cry
i’m going crazy, exhausted without you
i think of you without stopping
i hate it all, i hate every single day
it makes me cry, ring ding dong
if there’s a chance, i’ll catch you
i’m running, it’s starting, count down
i’m ready to be cut by your rose-like embrace, as i hold you again

i can only see you
i can only see you alone
look, i’m fair with everyone else but you
now i can’t live a day without you, please

hold me tight, hug me
can you trust me? can you trust me? can you trust me?
pull me in tight
hold me tight, hug me
can you trust me? can you trust me?
please, please, please pull me in and hug me

your cold face tells me everything rather than words
i can see a break up rising over me like a high tide
i know it will soon be our last but i can’t let you go
don’t talk, don’t leave, just quietly hold me girl

hold me tight, hug me
trust me, trust me, trust me
hold me tight, hug me
can you trust me? can you trust me?
please, please, please pull me in and hug me

you still shine
you’re still like a scented flower
now trust me, hold me once again
so i can feel you, hold me",FALSE,FALSE,,BTS,FALSE,KOR,FALSE
58,화양연화 The Most Beautiful Moment In Life Pt.1,The Most Beautiful Moment In Life Pt.1,2015-04-24,4,Skit: Expectation!,,Skit: Expectation!,,FALSE,FALSE,,BTS,FALSE,KOR,FALSE
59,화양연화 The Most Beautiful Moment In Life Pt.1,The Most Beautiful Moment In Life Pt.1,2015-04-24,5,쩔어 (DOPE) ,쩔어,DOPE,"welcome, it's your first time with bts, isn't it?

ayo ladies & gentleman
if you’re ready, i’ll start, yeah
i am different from the other guys
with my style, with my, my, my, my style

i worked all night, everyday
while you were out clubbing
don’t be surprised, listen every day
i got a feel, i got a feel

i’m kinda dope

we're drenched, drenched, drenched
in sweat, in our practice room
look, my great, great, great
dance moves prove it all
all the weak, loser, whiny idiots
they have nothing on me
cuz i'm full of hope haha

ok we're dope from head to toe
over half of the day, we drown in work
even if our youth rots in the studio
thanks to that, we're closer to success
girls, shout louder
make it ring, ring

i worked all night, every day
while you were playing in the club
i am different from other guys
i don’t wanna say yes
i don’t wanna say yes

make some noise, all right
till your body burns up, all night (all night)
cause we got fire (fire!)
higher (higher!)
i gotta make it, i gotta make it
it’s dope

i reject rejection
i'm always over the top
dope, dope, dope, dope
i reject rejection
you all work for me
dope, dope, dope

given up on 3? given up on 5??
i like the number 6, how about giving up on 6?
the media and adults say we don’t have willpower, condemning us like stocks
why are they killing us before we can even try, enemy enemy enemy
why are you hanging your head and accepting it already? energy energy energy
don’t ever give up, you know you not lonely
our dawn is prettier than the day
so can i get a little bit of hope yeah
wake your sleeping youth, go

i worked all night, every day
while you were playing in the club
i am differently from other guys
i don’t wanna say yes
i don’t wanna say yes

make some noise, all right
till your body burns up, all night, all night
cause we got fire fire
higher higher
i gotta make it, i gotta make it
it’s dope

i reject rejection
i was always too much
it’s dope
reject rejection
you're all my slaves
everyone follow me
it’s dope

this  is bts style
different from those lying wack jobs
every day is hustle life
i gotta make it fire baby
this is bts style
different from those lying wack jobs
every day is hustle life
i gotta make it
i gotta make it
i’m kinda awesome

say what!
say wo~ wo~
say what!
dope dope dope",FALSE,FALSE,,BTS,FALSE,KOR,FALSE
60,화양연화 The Most Beautiful Moment In Life Pt.1,The Most Beautiful Moment In Life Pt.1,2015-04-24,6,흥탄소년단 (Boyz With Fun) ,흥탄소년단,Boyz With Fun,"we’re here, the fun boys
here, here, the fun boys
we’re here, the fun boys
fun, fun
i don’t even know myself

we’re here, the fun boys
here, here, the fun boys
we’re here, the fun boys
fun, fun

the fun boys go until the dawn moon sets
this is so fun, all fakeness has gone home
so even if you’re tone-deaf or rhythm-deaf
it doesn’t matter, throw your timidness away
we’re having fun, fun fun fun
come gather here, i see your shoulder dance

let’s ride go with me
i see the peak over there
add on another prize to my days, i’m becoming weird
you can’t go to the peak by being normal baby
fun, fun, the engine is on
fun, fun, the speed is fast
look at me, i’m gonna go crazy today, don’t stop me
leave, leave, if you don’t wanna, just go home

the moment the music flows
i think i’ll go crazy, hey
you’re gonna be shaken by my body
right now, this moment

don’t ask me, i was always like this
i don’t even know, cuz i’m me from start to finish
wo wo wo wo
wo wo wo wo

we’re here, the fun boys
here, here, the fun boys
we’re here, the fun boys
fun, fun
i don’t even know myself

my fatal body movements
my insanity is crazy
i wanna do everything my way
so don’t touch me
though i’m the oldest, no no no
though they play with me, no no no
who cares?
i’m satisfied, ok

yo my name is v
i set the tone for the competition

hey hey hey stop stop!
take your pick, take your pick, hoshik, take your pick
if hope is with us, we won’t know time is passing
let’s wash ourselves with sweat
today, i’m it, mini miney mo
stop saying nonsense, you’re draining my energy
don’t even think about talking behind my back, i’m quick
i’ll bite you with my teeth till i see blood
did you eat? in chinese it’s chi fan le ma

the moment the music flows
i think i’ll go crazy, hey
you’re gonna be shaken by my body
right now, this moment

don’t ask me, i was always like this
i don’t even know, cuz i’m me from start to finish
wo wo wo wo
wo wo wo wo

all you fun people gather here
gather here
any other fun people?
get behind me
all you fun people gather here
gather here
any other fun people?
get behind me

don’t ask me, i was always like this
i don’t even know, cuz i’m me from start to finish
wo wo wo wo
wo wo wo wo

we’re here, the fun boys
here, here, the fun boys
we’re here, the fun boys
fun, fun
i don’t even know myself",FALSE,FALSE,,BTS,FALSE,KOR,FALSE
61,화양연화 The Most Beautiful Moment In Life Pt.1,The Most Beautiful Moment In Life Pt.1,2015-04-24,7,Converse High ,,Converse High ,"your converse high
your converse high
your converse high
converse high

i’m so into your converse highs
i can’t help it
i’m so into your converse highs
i like it so much

if i had only one day
i will go see the person who created converse highs
then i’ll tell that person, you saved the world
you made that girl born again
f your chanel f your alexander mcqueen
f your raf simons, just come here and check it
you can buy two pairs with just 100 dollars, you know what i want
white t-shirt, jeans and red converse highs, that’s it

alright, red orange yellow green blue violet indigo
the rainbow on your feet is shot like rambo
it aims at me, bang bang, shout out wow wow
together with your body makes me go hukhuk
big taxi, big cycle, big subway
no thanks, i wanna ride the big bus
rather than the stars in the sky, i wanna see the stars on your shoes
haha, without namjoon knowing

if brushed, it's meant to be
if soaked into, it's love
someone said that
but i've already been colored by you
i like you but still don’t wear converse lows

i’m so into your converse highs
i can’t help it
i’m so into your converse highs
i like it so much

your converse highs
i really really want yo
converse high
i really really like yo
converse high
i really really need yo
converse high converse high

converse converse, i really hate a converse
when you look all flashy with your black stockings
and your high heels, that’s just a lie
but you look better with jordan numbers
ha don’t you know? converse kill your charms
anyway, when you meet me, don’t wear converses
it’s too hard to take them off of you

if brushed, it's meant to be
if soaked into, it's love
someone said that
but i've already been colored by you
i like you but still don’t wear converse lows

i’m so into your converse highs
i can’t help it
i’m so into your converse highs
i like it so much

your converse highs
i really really want yo
converse high
i really really like yo
converse high
i really really need yo
converse high converse high

your converse highs
i really really want yo
converse high
i really really like yo
converse high
i really really need yo
converse high converse high
converse high",FALSE,FALSE,,BTS,FALSE,KOR,FALSE
