id,album_title,eng_album_title,album_rd,album_seq,track_title,kor_track_title,eng_track_title,lyrics,hidden_track,remix,featured,performed_by,repackaged,lang,has_full_ver
116,You Never Walk Alone,You Never Walk Alone,2017-02-13,6,First Love ,,First Love ,"the corner of my memory
a brown piano settled on one side
in the corner of my childhood house
a brown piano settled on one side

i remember that moment
way taller than my height
the brown piano that guided me
i looked up to you, i yearned for you
when i touched you with my small finger

i feel so nice mom i feel so nice
i played the piano wherever my hands took me
i didn’t know your significance back then
back then i was content with just looking at you

i remember back during my elementary school days
when my height
became taller than yours
i neglected you when i once yearned for you so
on top of the white jade-like keyboard
dust is piling on
your image that has been neglected
even then i didn’t know
your significance
no matter where i am
you always defended that spot
but i didn’t know that would be the last
you say don’t leave like this

don’t worry even if i leave
you’ll do well on your own
i remember when i first met you
before i knew it you grew up
though we are putting an end to our relationship
don’t ever feel sorry to me
i will get to meet you again no matter what form
greet me happily then

i remember back then when i met you that
i had completely forgotten, when i was around 14
the awkwardness was only for a moment, i touched you again
even though i was gone for a long time
without repulsion
you accepted me
without you i am nothing
after the dawn, two of us
we welcomed the morning together
don’t let go of my hand forever
i won’t let go of you again either

i remember back then
we burned up the last of my teen’s
yes the days when we couldn’t see an inch in front of us
we laughed, we cried
those days with you, those moments are now in memories
i said, grasping my crushed shoulder
i really can’t do any more
every time i wanted to give up
by my side you said
bastard you can really do it
yeah, yeah i remember back then
when i was fed up and lost
back then when i fell into a pit of despair
even when i pushed you away
even when i resented meeting you
you were firmly by my side
you didn’t have to say anything
so don’t ever let go of my hand
i won’t let you go ever again either
my birth and the end of my life
you will be there to watch over it all

the corner of my memory
a brown piano settled on one side
in the corner of my childhood house
a brown piano settled on one side",FALSE,FALSE,,SUGA,TRUE,KOR,FALSE
117,You Never Walk Alone,You Never Walk Alone,2017-02-13,7,Reflection ,,Reflection ,"i know
every life’s a movie
we got different stars and stories
we got different nights and mornings
our scenarios ain’t just boring
i find this movie very amusing
everyday, i want to shoot it well
i want to caress myself
i want to caress myself
but you know, sometimes
i really really hate myself
to be honest, quite often
i really hate myself
when i really hate myself, i go to dduksum
i just stand there with the familiar darkness
with the people that are smiling
and beer, which makes me smile
coming to me softly
fear, which holds my hand
it’s okay because everyone is in twos or threes
it’s good that i have a friend, too


the world is just another name for despair
my height is just another diameter for the earth
i am all of my joy and anxiety
it repeats everyday, the love and hate directed to me
hey you, who’s looking over the han river
if we bump into each other while passing, would it be fate?
or maybe we bumped into each other in our past life
maybe we bumped into each other countless times
in the darkness
people look happier than the day
everyone else knows where they’re supposed to be
but only i walk without purpose
but still, blending in with them is more comfortable
dduksum, which has swallowed up the night
hands me an entirely different world
i want to be free
i want to be free from freedom
because right now i’m happy but i’m unhappy
i’m looking at myself
at dduksum


i wish i could love myself
i wish i could love myself
i wish i could love myself
i wish i could love myself
i wish i could love myself
i wish i could love myself
i wish i could love myself
i wish i could love myself",FALSE,FALSE,,RM,TRUE,KOR,FALSE
118,You Never Walk Alone,You Never Walk Alone,2017-02-13,8,MAMA ,,MAMA ,"time travel the year of 2006
crazy for dance
i tightened my mom’s belt
despite my dad’s opposition, every time i attacked
without paying any concern
she floated the small boat of dreams

but i didn’t know my mom’s support
was not a open shortcut road
but a road of dreams while gripping debt
always
the problem of money eventually my mother
go away
had to work away from home

through the phone
i could hear my mom’s voice clearly (hello?)
the thing i remember
my mom’s strength at the time was a breaking ball to me
really
i was determined to succeed
with that promise alone
i became the son i am now

hey mama
now you can lean on me
i’ll always be by your side
hey mama
because you gave selflessly to me
because you were my support
hey mama
now you can believe in your son, you can smile
hey mama
hey mama

hey mama
i’m sorry mama
i know now a grace like the heavens mama

hey mama
so thanks mama
you became my blood and flesh mama

i remember mom
moonheungdong hiddink pc room
broadway restaurant
a veteran who ran on both feet for her family
failure is the mother of success mother
i learned from that passion and sincerity
wanna be wanna be
now when i become an adult
because you were fertilizer to a sprout
i will become a flower and become your own flower path
you walking on way way way

hey mama
now you can lean on me
i’ll always be by your side
hey mama
because you gave selflessly to me
because you were my support
hey mama
now you can believe in your son, you can smile
hey mama
hey mama

you had me feel the world
the breath you have created
today more than usual
i want to be held in your arms
what is higher than anything above the ground
what is wider than anything beneath the sky
the only one, mother’s hand is medicine hand
you are forever my placebo

i love mom

hey mama
now you can lean on me
i’ll always be by your side
hey mama
because you gave selflessly to me
because you were my support
hey mama
now you can believe in your son, you can smile
hey mama
hey mama

hey mama
now you can lean on me
i’ll always be by your side
hey mama
because you gave selflessly to me
because you were my support
hey mama
now you can believe in your son, you can smile
hey mama
hey mama",FALSE,FALSE,,J-HOPE,TRUE,KOR,FALSE
119,You Never Walk Alone,You Never Walk Alone,2017-02-13,9,Awake ,,Awake ,"it’s not that i believe it
but that i want to try holding out
because this is
all that i can do

i want to remain
i want to dream more
even so, what i’m saying is
that it’s time to leave

yeah it’s my truth
it’s my truth
i will be covered with wounds all over

but it’s my fate
it’s my fate
still, i want to struggle and fight

maybe i, i can never fly
i can’t fly like the flower petals over there
or as though i have wings
maybe i, i can’t touch the sky
still, i want to stretch my hand out
i want to run, just a bit more

i’m just walking and walking, among this darkness
my happy times asked me this question
you, are you really okay, it asked me
oh no

i replied, no, i’m so afraid
still, i hold the 6 flowers tightly in my hands
i, i’m just walking, i said
oh no

but it’s my fate
it’s my fate
still, i want to struggle and fight

maybe i, i can never fly
i can’t fly like the flower petals over there
or as though i have wings
maybe i, i can’t touch the sky
still, i want to stretch my hand out
i want to run, just a bit more

wide awake, wide awake, wide awake
don’t cry
wide awake, wide awake, wide awake
no lie
wide awake, wide awake, wide awake
don’t cry
wide awake, wide awake, wide awake
no lie

maybe i, i can never fly
i can’t fly like the flower petals over there
or as though i have wings
maybe i, i can’t touch the sky
still, i want to stretch my hand out
i want to run
just a bit more",FALSE,FALSE,,JIN,TRUE,KOR,FALSE
120,You Never Walk Alone,You Never Walk Alone,2017-02-13,10,Lost ,,Lost ,"i’m still standing here with my eyes closed
lost between the deserts and oceans
i’m still wandering
where should i go yeah
i didn’t know there were this many
paths i can’t go and paths i can’t take
i never felt this way before
am i becoming an adult?

this is too hard, is this path right for me
i am confused
never leave me alone
i still believe even though it’s unbelievable
to lose your path
is the way to find that path

lost my way
constantly pushing without rest
within the harsh rainstorms
lost my way
within a complicated world without an exit
lost my way
lost my way
no matter how much i wander
i want to believe in my path

lost my way
found my way
lost my way
found my way

i once saw an ant going somewhere
there is no way to find the path at once
constantly crashing and crawling forward
to find something to eat
roaming for days

you know
there is a reason for all this frustration
i believe that we’re on the right path
if we ever find it
we will return home at once
just like an ant

this is too hard, is this path right for me
i am so confused
don’t you leave me alone
i still want to believe even though it’s unbelievable
to lose your path
is the way to find that path

lost my way
constantly pushing without rest
within the harsh rainstorms
lost my way
within a complicated world without an exit
lost my way
lost my way
i wander
i want to believe in my path

so long
goodbye to my hope with no promise
so long
even if i’m slow i will walk with my own feet
because i know this path is mine to take
even if i go back, i will reach this path eventually
i never i will never
i will never lose my dream

lost my way
constantly pushing without rest
within the harsh rainstorms
lost my way
within a complicated world without an exit
lost my way
lost my way
i wander
i want to believe in my path

lost my way
found my way
lost my way
found my way",FALSE,FALSE,,JUNGKOOK; V; JIMIN; JIN,TRUE,KOR,FALSE
121,You Never Walk Alone,You Never Walk Alone,2017-02-13,11,BTS Cypher 4 ,,BTS Cypher 4 ,"“name, name!” sorry bae
“pronunciation, pronunciation!” sorry bae
“diction, diction, diction!” sorry bae
“oh, face not an idol..” sorry bae

because i’m breathing i’m sorry bae
because i’m too healthy i’m sorry bae
i’m on the air i’m sorry bae
errthing errthing errthing
sorry bae
the sound that i’m making now bae
to someone else, it’s like a dog’s bark bae
why don’t you change your pattern
of talking shit about others bae
it’s about to get boring, boring bae
i’m not hateful of you anymore
i’m not hateful of you anymore sorry bae
i’ll be the drum, just hit me hard
let’s just try it, samulnori, bae
i’m a monster, my tail is too long, bae
you’ll shoot me anyway, bae
in that case, a zoo would be more comfortable, bae
you want it too, something to chew on, bae
you hate me but you know me
you hate me but you know me
i like hate comments more than no comments
i don’t know you
but you know my name

i love i love i love myself
i love i love i love myself
i know i know i know myself
ya playa haters you should love yourself
brr

i wanna get sleep time
without a chance to rest, we’re receiving spotlight
ahh you wanna be my life
those who are starving, just be my human shield
contacted softly and got spammed on my accord
haul to the stage all innocent okay
but i can’t be satisfied just being here
i’m climbing up there, high high high
that’s right, my method is different
i take on the road no matter what
sewing stich by stich
if you’re not able, put an end to it
there is no possibility
of pronouncing “failure”
i love ma rule, the work that i do with my bros
players in a league of their own
i’ll become the supervisor above them
so come what may
following 1verse, i’ll draw a bigger picture
for the rest of your life
continue screaming from that position
dream come true
honor and wealth isn’t that you
everyone chu on my foot sole after all
click, i’m cat, everyone’s mouse
i choose and put an x like kaws
i move in next year ma house
and high five with my brick
open your eyes and look at my ambition
lean in your ears and listen
this will be the first and final words

i love i love i love myself
i love i love i love myself
i know i know i know myself
ya playa haters you should love yourself
brr

back back to the basic
microphone check
call me a crow tit or badass
yes in this rap game
i’m the generous one
to rehabilitate the rap man who began to slack
is my first plan hashtag
sucka betta run gang gang in insta
that’s their life
my life is just day by day
payday, paycheck, rolex on my wrist
click clack to the bang hang
click clack to the pow
i’m so high how dare you covet
even if you run up to it, it’s too high for you to reach
the difference is pretty big, you can’t see it
after shattering your delusions
about your shitty cars
and once everyone’s done toying with them

so fly above your face that became a corpse
click clack to the bang, you and you
i’m always thankful, for not earning anything so easily
why is it my fault, that your life is noncommittal
keep on living like that vaguely
sorry but continue to look
because i’m gonna earn more from now
by all means please live healthily

i love i love i love myself
i love i love i love myself
i know i know i know myself
ya playa haters you should love yourself
brr

i love i love i love myself
i love i love i love myself
i know i know i know myself
ya playa haters you should love yourself
brr",FALSE,FALSE,,RM; SUGA; J-HOPE,TRUE,KOR,FALSE
122,You Never Walk Alone,You Never Walk Alone,2017-02-13,12,Am I Wrong ,,Am I Wrong ,"am i wrong, fallin' in love with you
tell me am i wrong
while your other man was out there
cheatin' and lyin', steppin' all over you

the world’s goin’ crazy
how about you how bout ya
you think it is okay
i don’t think it’s that okay
have ears but don’t listen
have eyes but don’t see
fish live in all our hearts
its name is selfish, selfish
we’re all dogs, pigs, become dogs because we’re angry
stork vs crow-tit warring errday
crazy world yeah
makes us crazy yeah
that’s right we’re all crazy
all right now give a shout
mayday mayday

it seems like the entire world has gone crazy
seems like the end
oh why oh why
oh why oh why
oh why why why why
oh my god

am i wrong
did i say something wrong?
did i lie?
going crazy (gone crazy gone crazy)
crazy (gone crazy gone crazy)
am i wrong
am i wrong
where am i going
the world’s going crazy

are you ready for this
are you ready for this
are you ready for this
no, i'm not

that’s right kid you gone crazy
the fact that you’re not crazy in a crazy world is crazy
the earth and sky and all around (hell yeah)
online offline (hell yeah)

if what you see on the news is nothing to you
if that comment is nothing to you
if that hatred is nothing to you
you’re not normal, you’re abnormal

it seems like the entire world has gone crazy
seems like the end
oh why oh why
oh why oh why
oh why why why why
oh my god

am i wrong
did i say something wrong?
am i wrong
did i lie?
going crazy (gone crazy gone crazy)
crazy (gone crazy gone crazy)
am i wrong (am i wrong)
am i wrong (am i wrong)
where am i going
the world’s going crazy
though i walk this crazy world’s path
i still want to live longer
i want to find it, my faith

am i wrong
did i say something wrong?
did i lie?
going crazy (gone crazy gone crazy)
crazy (gone crazy gone crazy)
am i wrong
am i wrong
where am i going
the world’s going crazy

are you ready for this
are you ready for this
are you ready for this",FALSE,FALSE,,BTS,TRUE,KOR,FALSE
123,You Never Walk Alone,You Never Walk Alone,2017-02-13,13,21세기 소녀 (21st Century Girl) ,21세기 소녀,21st Century Girl,"you worth it you perfect
deserve it just work it
you look elegant, elegant
also you’re pretty, pretty
you shine, shine
you’re the truth and the reason

if anyone keeps insulting you, insulting you
tell em you’re my lady
go tell them, tell them
whatever other people say
whatever this world tells you
you’re the best to me just the way you are

don’t ever be scared
whatever people say, you’re okay alright
you are strong
you say yes or no yes or no

to the 20th century girls
live your life
live your life come on baby
to the 21st century girls
you don’t mind
you don’t mind that new lady

tell them that you’re strong
tell them you’re enough
let you go let you go let you go
let it go oh

all my ladies put your hands up
21st century girl
hands up
all my ladies put your hands up
now scream

you pass by, the guys say
oh yeah what is she, who is she
they go out of their mind, the girls say
oh what is he, who is he

oh bae don’t lower yourself
okay don’t set yourself to them
you’re mine
you’re beautiful enough
don’t worry don’t worry
baby you’re beautiful
you you you

to the 20th century girls
live your life
live your life come on baby
to the 21st century girls
you don’t mind
you don’t mind that new lady

tell them you’re strong
tell them you’re enough
let you go let you go let you go
let it go oh

all my ladies put your hands up
21st century girl
hands up
all my ladies put your hands up
now scream

everybody wanna love you
everybody gonna love you
don’t worry about anything else

everybody wanna love you bae
everybody gonna love you bae
you deserve to be loved

all my ladies put your hands up
21st century girl
hands up
all my ladies put your hands up
now scream

all my ladies put your hands up
21st century girl
hands up
all my ladies put your hands up
now scream",FALSE,FALSE,,BTS,TRUE,KOR,FALSE
124,You Never Walk Alone,You Never Walk Alone,2017-02-13,14,둘! 셋! (그래도 좋은 날이 더 많기를) [2! 3! (Still Wishing For More Good Days)] ,둘! 셋! (그래도 좋은 날이 더 많기를),2! 3! (Still Wishing For More Good Days),"been trying to tell you this
i was supposed to tell you this
this is all for you

let’s only walk on flower trails
i can’t say that
let’s only see good things
i can’t say that either
saying that there will only be good things from now on
saying that you won’t get hurt
i can’t say that
i can’t lie like that

""because you’re all idols
it sucks even if i don’t hear it
i don’t like your lyrics
i can already imagine the performance
because you don’t have power, you would certainly
have done dirty deeds in the past
observing how you act
soon you’ll cease to exist.""
(thank you so much)
because of your inferiority complex
i was able to prove myself something
i wasn’t able to do when in high school
hands clapping, yes, keep on going, keep on going
we’ll be happy by ourselves
good, yeah, i’m good

it’s okay come on when i say one two three forget it
erase all sad memories hold my hand and smile

it’s okay, come on when i say one, two, three forget it
erase all sad memories
smile holding onto each other’s hands

hoping for more good days
if you believe what i say then one, two, three (one two three)
if you believe then one, two, three (one two three)

hoping for more good days
if you believe me then one, two, three(one two three)
if you believe then one, two, three (one two three)
hoping that everything will change when we say

1, 2, 3
hoping that everything will change
for a better day
because we are together

me, a shadow behind the stage
me, in the depth of darkness
i didn’t want to show everything, including my pain
but because i’m still unaccustomed
i just wanted to make you smile
i wanted to do good
so thanks
for believing in someone like me
for dealing with these tears and wounds
so thanks
for becoming my light
for becoming the flower in the most beautiful moment in life

it’s okay, come on when i say one, two, three forget it
erase all sad memories, hold my hand and smile

it’s okay, come on when i say one, two, three forget it
erase all sad memories
smile holding onto each other’s hands

hoping for more good days
if you believe what i say then one, two, three
if you believe then one, two, three

hoping for more good days
if you believe what i say then one, two, three
if you believe then one, two, three

if you believe then 1, 2, 3
if you believe then 1, 2, 3
if you believe then 1, 2, 3
if you believe then 2, 3 say

it’s okay, come on when i say one, two, threeforget it
erase all sad memories, hold my hand and smile
it’s okay, come on when i say one, two, three forget it
erase all sad memories
smile holding onto each other’s hands
hoping for more good days
if you believe what i say then one, two, three
if you believe then one, two, three
hoping for more good days
if you believe what i say then one, two, three
if you believe then one, two, three
it’s okay, come on when i say one, two, three forget it
erase all sad memories hold my hand and smile
it’s okay, come on when i say one, two, three forget it
erase all sad memories
smile holding onto each other’s hands
it’s okay, come on when i say one, two, three forget it
erase all sad memories
smile holding onto each other’s hands",FALSE,FALSE,,BTS,TRUE,KOR,FALSE
125,You Never Walk Alone,You Never Walk Alone,2017-02-13,15,봄날 (Spring Day) ,봄날,Spring Day,"miss you
saying this makes me miss you even more
miss you
even though i’m looking at your photo
time’s so cruel, i hate us
seeing each other for once is now so hard between us

it’s all winter here, even in august
my heart is running on the time
alone on the snowpiercer
wanna get to the other side of the earth, holding your hand
wanna put an end to this winter
how much longing should we see snowing down
to have the days of spring, friend

like the tiny dust, tiny dust floating in the air
will i get to you a little faster
if i was the snow in the air

snowflakes fall down
and get farther away little by little
i miss you (i miss you)
i miss you (i miss you)
how long do i have to wait
and how many sleepless nights do i have to spend
to see you (to see you)
to meet you (to meet you)

passing by the edge of the cold winter
until the days of spring
until the days of flower blossoms
please stay, please stay there a little longer

is it you who changed (is it you who changed)
or is it me (or is it me)
i hate this moment, this time flowing by
we are changed you know
just like everyone you know

yes i hate you, you left me
but i never stopped thinking about you, not even a day
honestly i miss you, but i’ll erase you
'cause it hurts less than to blame you

i try to exhale you in pain
like smoke, like white smoke
i say that i’ll erase you
but i can’t really let you go yet

snowflakes fall down
and get farther away little by little
i miss you (i miss you)
i miss you (i miss you)
how long do i have to wait
and how many sleepless nights do i have to spend
to see you (to see you)
to meet you (to meet you)

you know it all
you’re my best friend
the morning will come again
no darkness, no season is eternal

maybe it’s cherry blossoms
and this winter will be over
i miss you (i miss you)
i miss you (i miss you)
wait a little bit, just a few more nights
i’ll be there to see you (i'll go there to meet you)
i’ll come for you (i'll come for you)

passing by the edge of the cold winter
until the days of spring
until the days of flower blossoms
please stay, please stay there a little longer",FALSE,FALSE,,BTS,FALSE,KOR,FALSE
